{
  "$schema": "./schemas/uscis-manifest.schema.json",
  "manifestVersion": "1.0.0",
  "lastVerifiedAt": "2026-09-14T00:00:00Z",
  "authority": "USCIS",
  "sourceSnapshotUrl": "https://www.uscis.gov/forms/all-forms",
  "reconciliationStatus": "COMPLETE",
  "summary": {
    "totalOfficialForms": 117,
    "bySeries": {
      "I": 91,
      "N": 10,
      "G": 14,
      "OTHER": 2
    },
    "byPreparationCapability": {
      "FILLABLE_PDF": 104,
      "STATIC_ASSISTED": 10,
      "EXTERNAL_REFERENCE": 3
    },
    "byParentEpic": {
      "INF-06": 91,
      "INF-07": 10,
      "INF-08": 16
    }
  },
  "forms": [
    {
      "formId": "I-102",
      "formNumber": "I-102",
      "title": "Application for Replacement/Initial Nonimmigrant Arrival-Departure Document",
      "series": "I",
      "issuer": "USCIS",
      "sourceUrl": "https://www.uscis.gov/i-102",
      "pdfUrl": "https://www.uscis.gov/sites/default/files/document/forms/i-102.pdf",
      "instructionsUrl": "https://www.uscis.gov/sites/default/files/document/forms/i-102instr.pdf",
      "editionDate": "04/01/24",
      "preparationCapability": "FILLABLE_PDF",
      "artifactType": "OFFICIAL_PDF",
      "capabilityRationale": "Paper/PDF petition for replacement I-94 arrival/departure record.",
      "parentEpic": "INF-06",
      "status": "RECONCILED",
      "requiresOfficialSourceAllowlist": true,
      "requiresTwoPersonActivation": true
    },
    {
      "formId": "I-129",
      "formNumber": "I-129",
      "title": "Petition for a Nonimmigrant Worker",
      "series": "I",
      "issuer": "USCIS",
      "sourceUrl": "https://www.uscis.gov/i-129",
      "pdfUrl": "https://www.uscis.gov/sites/default/files/document/forms/i-129.pdf",
      "instructionsUrl": "https://www.uscis.gov/sites/default/files/document/forms/i-129instr.pdf",
      "editionDate": "04/01/24",
      "preparationCapability": "FILLABLE_PDF",
      "artifactType": "OFFICIAL_PDF",
      "capabilityRationale": "Multi-classification business petition with extensive classification supplements.",
      "parentEpic": "INF-06",
      "status": "RECONCILED",
      "requiresOfficialSourceAllowlist": true,
      "requiresTwoPersonActivation": true
    },
    {
      "formId": "I-129CW",
      "formNumber": "I-129CW",
      "title": "Petition for a CNMI-Only Nonimmigrant Transitional Worker",
      "series": "I",
      "issuer": "USCIS",
      "sourceUrl": "https://www.uscis.gov/i-129cw",
      "pdfUrl": "https://www.uscis.gov/sites/default/files/document/forms/i-129cw.pdf",
      "instructionsUrl": "https://www.uscis.gov/sites/default/files/document/forms/i-129cwinstr.pdf",
      "editionDate": "04/01/24",
      "preparationCapability": "FILLABLE_PDF",
      "artifactType": "OFFICIAL_PDF",
      "capabilityRationale": "Specialized regional worker petition with employer attestation.",
      "parentEpic": "INF-06",
      "status": "RECONCILED",
      "requiresOfficialSourceAllowlist": true,
      "requiresTwoPersonActivation": true
    },
    {
      "formId": "I-129CWR",
      "formNumber": "I-129CWR",
      "title": "Semiannual Report for CW-1 Employers",
      "series": "I",
      "issuer": "USCIS",
      "sourceUrl": "https://www.uscis.gov/i-129cwr",
      "pdfUrl": "https://www.uscis.gov/sites/default/files/document/forms/i-129cwr.pdf",
      "instructionsUrl": "https://www.uscis.gov/sites/default/files/document/forms/i-129cwrinstr.pdf",
      "editionDate": "04/01/24",
      "preparationCapability": "FILLABLE_PDF",
      "artifactType": "OFFICIAL_PDF",
      "capabilityRationale": "Employer reporting form for CW-1 workers.",
      "parentEpic": "INF-06",
      "status": "RECONCILED",
      "requiresOfficialSourceAllowlist": true,
      "requiresTwoPersonActivation": true
    },
    {
      "formId": "I-129F",
      "formNumber": "I-129F",
      "title": "Petition for Alien Fianc\u00e9(e)",
      "series": "I",
      "issuer": "USCIS",
      "sourceUrl": "https://www.uscis.gov/i-129f",
      "pdfUrl": "https://www.uscis.gov/sites/default/files/document/forms/i-129f.pdf",
      "instructionsUrl": "https://www.uscis.gov/sites/default/files/document/forms/i-129finstr.pdf",
      "editionDate": "04/01/24",
      "preparationCapability": "FILLABLE_PDF",
      "artifactType": "OFFICIAL_PDF",
      "capabilityRationale": "Standard fillable AcroForm for K-1/K-3 visa petitions.",
      "parentEpic": "INF-06",
      "status": "RECONCILED",
      "requiresOfficialSourceAllowlist": true,
      "requiresTwoPersonActivation": true
    },
    {
      "formId": "I-129H1B",
      "formNumber": "H-1B Registration",
      "title": "H-1B Electronic Registration Process",
      "series": "I",
      "issuer": "USCIS",
      "sourceUrl": "https://www.uscis.gov/working-in-the-united-states/temporary-workers/h-1b-specialty-occupations/h-1b-electronic-registration-process",
      "pdfUrl": null,
      "instructionsUrl": "https://www.uscis.gov/sites/default/files/document/guides/H-1B-Electronic-Registration-Guide.pdf",
      "editionDate": "FY2025",
      "preparationCapability": "EXTERNAL_REFERENCE",
      "artifactType": "EXTERNAL_LINK",
      "capabilityRationale": "Online electronic registration portal managed directly through myUSCIS accounts during statutory registration windows.",
      "parentEpic": "INF-06",
      "status": "RECONCILED",
      "requiresOfficialSourceAllowlist": true,
      "requiresTwoPersonActivation": true
    },
    {
      "formId": "I-129H2A",
      "formNumber": "H-2A Supplement",
      "title": "H-2A Petition Supplement to Form I-129",
      "series": "I",
      "issuer": "USCIS",
      "sourceUrl": "https://www.uscis.gov/i-129",
      "pdfUrl": "https://www.uscis.gov/sites/default/files/document/forms/i-129.pdf",
      "instructionsUrl": "https://www.uscis.gov/sites/default/files/document/forms/i-129instr.pdf",
      "editionDate": "04/01/24",
      "preparationCapability": "FILLABLE_PDF",
      "artifactType": "OFFICIAL_PDF",
      "capabilityRationale": "Agricultural temporary worker supplement incorporated within I-129.",
      "parentEpic": "INF-06",
      "status": "RECONCILED",
      "requiresOfficialSourceAllowlist": true,
      "requiresTwoPersonActivation": true
    },
    {
      "formId": "I-129S",
      "formNumber": "I-129S",
      "title": "Nonimmigrant Petition Based on Blanket L Petition",
      "series": "I",
      "issuer": "USCIS",
      "sourceUrl": "https://www.uscis.gov/i-129s",
      "pdfUrl": "https://www.uscis.gov/sites/default/files/document/forms/i-129s.pdf",
      "instructionsUrl": "https://www.uscis.gov/sites/default/files/document/forms/i-129sinstr.pdf",
      "editionDate": "04/01/24",
      "preparationCapability": "FILLABLE_PDF",
      "artifactType": "OFFICIAL_PDF",
      "capabilityRationale": "Intracompany transferee petition under blanket L classification.",
      "parentEpic": "INF-06",
      "status": "RECONCILED",
      "requiresOfficialSourceAllowlist": true,
      "requiresTwoPersonActivation": true
    },
    {
      "formId": "I-130",
      "formNumber": "I-130",
      "title": "Petition for Alien Relative",
      "series": "I",
      "issuer": "USCIS",
      "sourceUrl": "https://www.uscis.gov/i-130",
      "pdfUrl": "https://www.uscis.gov/sites/default/files/document/forms/i-130.pdf",
      "instructionsUrl": "https://www.uscis.gov/sites/default/files/document/forms/i-130instr.pdf",
      "editionDate": "04/01/24",
      "preparationCapability": "FILLABLE_PDF",
      "artifactType": "OFFICIAL_PDF",
      "capabilityRationale": "Core family reunification petition mapped with AcroForm fields and supplemental addendum support.",
      "parentEpic": "INF-06",
      "status": "RECONCILED",
      "requiresOfficialSourceAllowlist": true,
      "requiresTwoPersonActivation": true
    },
    {
      "formId": "I-130A",
      "formNumber": "I-130A",
      "title": "Supplemental Information for Spouse Beneficiary",
      "series": "I",
      "issuer": "USCIS",
      "sourceUrl": "https://www.uscis.gov/i-130",
      "pdfUrl": "https://www.uscis.gov/sites/default/files/document/forms/i-130a.pdf",
      "instructionsUrl": "https://www.uscis.gov/sites/default/files/document/forms/i-130instr.pdf",
      "editionDate": "04/01/24",
      "preparationCapability": "FILLABLE_PDF",
      "artifactType": "OFFICIAL_PDF",
      "capabilityRationale": "Mandatory spouse beneficiary supplement for Form I-130 petitions.",
      "parentEpic": "INF-06",
      "status": "RECONCILED",
      "requiresOfficialSourceAllowlist": true,
      "requiresTwoPersonActivation": true
    },
    {
      "formId": "I-131",
      "formNumber": "I-131",
      "title": "Application for Travel Documents, Parole Documents, and Arrival/Departure Records",
      "series": "I",
      "issuer": "USCIS",
      "sourceUrl": "https://www.uscis.gov/i-131",
      "pdfUrl": "https://www.uscis.gov/sites/default/files/document/forms/i-131.pdf",
      "instructionsUrl": "https://www.uscis.gov/sites/default/files/document/forms/i-131instr.pdf",
      "editionDate": "04/01/24",
      "preparationCapability": "STATIC_ASSISTED",
      "artifactType": "XFA",
      "capabilityRationale": "Official PDF uses dynamic XFA encoding requiring interactive specialist review and assisted preparation packaging.",
      "parentEpic": "INF-06",
      "status": "RECONCILED",
      "requiresOfficialSourceAllowlist": true,
      "requiresTwoPersonActivation": true
    },
    {
      "formId": "I-131A",
      "formNumber": "I-131A",
      "title": "Application for Travel Document (Carrier Documentation)",
      "series": "I",
      "issuer": "USCIS",
      "sourceUrl": "https://www.uscis.gov/i-131a",
      "pdfUrl": "https://www.uscis.gov/sites/default/files/document/forms/i-131a.pdf",
      "instructionsUrl": "https://www.uscis.gov/sites/default/files/document/forms/i-131ainstr.pdf",
      "editionDate": "04/01/24",
      "preparationCapability": "FILLABLE_PDF",
      "artifactType": "OFFICIAL_PDF",